"RecordID";"TimeStamp";"DeltaToUTC";"UserID";"ObjectID";"Description";"Comment";"Checksum"
0;"21/10/2019 15:10:55";"-2:00";"Sistema";"Applicazione";"Nuovo file registro durante l'esecuzione di  nel pannello operatore SPAMI-PC. Progetto: '200LKDv236_PSPE13001_V02.OP - 0' release 6972, creato con WinCC flexible 2008 SP3 AdvancedWinCC flexible RT 2008 SP3";;rl2grC
475193;"21/10/2019 15:10:55";"-2:00";"Sistema";"Archivi";"Esportazione di un archivio.";;UY5sKH
0;"21/10/2019 15:10:59";"-2:00";"Sistema";"Applicazione";"Fine dell'esecuzione del programma di WinCC flexible RT 2008 SP3 sul pannello operatore SPAMI-PC.";;TYL2Rh
0;"21/10/2019 15:11:08";"-2:00";"Sistema";"Applicazione";"Avvio del runtime di  nel pannello operatore SPAMI-PC. Progetto: '200LKDv236_PSPE13001_V02.OP - 0' release 6972, creato con WinCC flexible 2008 SP3 AdvancedWinCC flexible RT 2008 SP3";;1JliRM
475194;"21/10/2019 15:11:08";"-2:00";"Sistema";"Amministrazione utenti";"Importazione amministrazione utenti terminata senza errori.";;7vCzxQ
475195;"21/10/2019 15:11:08";"-2:00";"Sistema";"Applicazione";"Cambio al modo di funzionamento 'online'.";;fInhBo
0;"21/10/2019 15:11:10";"-2:00";"Sistema";"Archivi";"File di archivio chiusi.";;lvF4U4
"$RT_COUNT$";8;WriK3w;;;;;BBB9LN
