"RecordID","TimeStamp","DeltaToUTC","UserID","ObjectID","Description","Comment","Checksum"
0,"07/08/2015 08:35:22","-2:00","System","Application","New log file during run of  on device . Project: '. - ' Build , created with .WinCC flexible RT 2008 SP3WinCC flexible RT 2008 SP3WinCC flexible RT 2008 SP3WinCC flexible RT 2008 SP3WinCC flexible RT 2008 SP3WinCC flexible RT 2008 SP3WinCC flexible RT 2008 SP3",,Eypkia
95230,"07/08/2015 08:35:21","-2:00","System","Logs","Exporting a log.",,POpFjs
95231,"07/08/2015 08:35:29","-2:00",,"Recipe","Loading recipe number 1 ( Ampoules. 1ml ) on the interface.",,dpwjp4
95232,"07/08/2015 08:35:30","-2:00",,"Recipe","Data trasfered to PLC",,yW3iAP
95233,"07/08/2015 08:35:30","-2:00",,"Warning","ALARM OZONE SENSOR  On",,XE4V82
95234,"07/08/2015 08:35:30","-2:00",,"Warning","PVSI NOT RUNNING   On",,hRYbuz
95235,"07/08/2015 08:35:30","-2:00",,"Warning","WARNING INFEED BELT MINIM LOAD  On",,3cPkWm
95236,"07/08/2015 08:35:30","-2:00",,"Warning","WARNING ACCEPTED TRAY ALMOST FULL  On",,JuTt+k
95237,"07/08/2015 08:35:30","-2:00",,"Alarm","EMERGENCY  On",,IX+UEG
95238,"07/08/2015 08:35:30","-2:00",,"Alarm","ALARM SAFETY CLUTCH LOADING STARWHEEL  On",,9alM8k
95239,"07/08/2015 08:35:30","-2:00",,"Alarm","ALARM SAFETY CLUTCH INTERMITTENT STARWHEEL IMPUT  On",,+zSb5I
95240,"07/08/2015 08:35:30","-2:00",,"Alarm","ALARM SAFETY CLUTCH INTERMITTENT STARWHEEL OUTPUT   On",,s//ttt
95241,"07/08/2015 08:35:30","-2:00",,"Alarm","ALARM INFEED BELT MOTOR  On",,jdutke
95242,"07/08/2015 08:35:30","-2:00",,"Alarm","ALARM ROTATION MOTOR 1  On",,dB6qCq
95243,"07/08/2015 08:35:30","-2:00",,"Alarm","ALARM ROTATION MOTOR 2  On",,hLdEpl
95244,"07/08/2015 08:35:30","-2:00",,"Alarm","ALARM MISSING COMUNICATION WITH INTERFACE  On",,lmqhmV
95245,"07/08/2015 08:35:30","-2:00",,"Alarm","ALARM MISSING ST0 TIP REJECTED TRAYS   On",,0fiVGg
95246,"07/08/2015 08:35:30","-2:00",,"Alarm","ALARM MISSING LKD REJECTED TRAYS   On",,dS7eih
95247,"07/08/2015 08:35:30","-2:00",,"Alarm","PVSI NOT READY  On",,hdE9sn
95248,"07/08/2015 08:35:30","-2:00",,"Alarm","PVSI AND WINCC PRODUCT DIFFERENT  On",,TiGHwW
95249,"07/08/2015 08:35:30","-2:00",,"Alarm","Alarm profibus nodo 3 (encoder)  On",,Yg4SUL
95250,"07/08/2015 08:35:30","-2:00",,"Alarm","Alarm profibus nodo 4 (PC)  On",,pSgfZb
95251,"07/08/2015 08:35:30","-2:00",,"Alarm","WARNING MISSING LOGIN OPERATION  On",,9zkrYQ
95252,"07/08/2015 08:35:34","-2:00",,"Alarm","ALARM MISSING COMUNICATION WITH INTERFACE  Off",,D+dESy
95253,"07/08/2015 11:53:19","-2:00",,"Warning","ALARM OZONE SENSOR  Off",,+EIBp9
95254,"07/08/2015 11:53:19","-2:00",,"Alarm","ALARM SAFETY CLUTCH LOADING STARWHEEL  Off",,2DdwVX
95255,"07/08/2015 11:53:19","-2:00",,"Alarm","ALARM SAFETY CLUTCH INTERMITTENT STARWHEEL IMPUT  Off",,YpHXlD
95256,"07/08/2015 11:53:19","-2:00",,"Alarm","ALARM SAFETY CLUTCH INTERMITTENT STARWHEEL OUTPUT   Off",,KJn7Oo
95257,"07/08/2015 11:53:19","-2:00",,"Alarm","ALARM ROTATION MOTOR 1  Off",,qtJIr6
95258,"07/08/2015 11:53:19","-2:00",,"Alarm","ALARM ROTATION MOTOR 2  Off",,RdCht3
95259,"07/08/2015 11:53:19","-2:00",,"Alarm","ALARM MISSING ST0 TIP REJECTED TRAYS   Off",,KDyojr
95260,"07/08/2015 11:53:19","-2:00",,"Alarm","ALARM MISSING LKD REJECTED TRAYS   Off",,mHSs4o
95261,"07/08/2015 11:53:19","-2:00",,"Alarm","Alarm profibus nodo 3 (encoder)  Off",,s9nSCn
95262,"07/08/2015 11:53:19","-2:00",,"Alarm","Alarm profibus nodo 4 (PC)  Off",,wKwbq4
95263,"07/08/2015 11:53:20","-2:00",,"Alarm","EMERGENCY  Off",,7UvEhZ
95264,"07/08/2015 11:53:20","-2:00",,"Alarm","ALARM INFEED BELT MOTOR  Off",,mp3UMZ
95265,"07/08/2015 15:27:59","-2:00",,"Warning","WARNING UPS  On",,GfV2nY
95266,"07/08/2015 15:27:59","-2:00",,"Warning","ALARM OZONE SENSOR  On",,fSPSlb
95267,"07/08/2015 15:27:59","-2:00",,"Alarm","ALARM INFEED BELT MOTOR  On",,kq7r4n
95268,"07/08/2015 15:27:59","-2:00",,"Warning","WARNING REJECTED TRAY ALMOST FULL  On",,b1LZEn
95269,"07/08/2015 15:27:59","-2:00",,"Warning","WARNING MISSING REJECTED TRAY HIGH ST0  On",,QfnOfu
95270,"07/08/2015 15:27:59","-2:00",,"Warning","WARNING MISSING REJECTED TRAY LOW ST0   On",,fFqE52
95271,"07/08/2015 15:27:59","-2:00",,"Alarm","EMERGENCY  On",,Y1/PSE
95272,"07/08/2015 15:27:59","-2:00",,"Alarm","ALARM SAFETY CLUTCH LOADING STARWHEEL  On",,kSQHck
95273,"07/08/2015 15:27:59","-2:00",,"Alarm","ALARM SAFETY CLUTCH INTERMITTENT STARWHEEL IMPUT  On",,oSfhSO
95274,"07/08/2015 15:27:59","-2:00",,"Alarm","ALARM SAFETY CLUTCH INTERMITTENT STARWHEEL OUTPUT   On",,n7eAtC
95275,"07/08/2015 15:27:59","-2:00",,"Alarm","ALARM MAIN MOTOR  On",,vNQ2pk
95276,"07/08/2015 15:27:59","-2:00",,"Alarm","ALARM ROTATION MOTOR 1  On",,TF06Ec
95277,"07/08/2015 15:27:59","-2:00",,"Alarm","ALARM ROTATION MOTOR 2  On",,yIEpS+
95278,"07/08/2015 15:27:59","-2:00",,"Alarm","ALARM MISSING ST0 TIP REJECTED TRAYS   On",,9stzuG
95279,"07/08/2015 15:27:59","-2:00",,"Alarm","ALARM MISSING LKD REJECTED TRAYS   On",,X5x8bj
95280,"07/08/2015 15:27:59","-2:00",,"Alarm","Alarm profibus nodo 3 (encoder)  On",,IxJXaj
95281,"10/08/2015 11:21:34","-2:00","System","Application","The last known sequential number for operator actions differs from the number in the log. Continuing with a higher number, 95281.",,iWfjGP
0,"10/08/2015 11:21:37","-2:00","System","Application","Startup of  on device . Project: '. - ' Build , created with WinCC flexible RT 2008 SP3WinCC flexible RT 2008 SP3WinCC flexible RT 2008 SP3WinCC flexible RT 2008 SP3WinCC flexible RT 2008 SP3WinCC flexible RT 2008 SP3WinCC flexible RT 2008 SP3",,wMDGEe
95282,"10/08/2015 11:21:38","-2:00","System","User administration","Password list imported successfully.",,uG5Zm5
95283,"10/08/2015 11:21:38","-2:00","System","Application","Change to operating mode 'online'.",,8rSxU6
0,"10/08/2015 11:21:43","-2:00","System","Logs","Log files closed.",,OJ8Q/o
"$RT_COUNT$",58,kk14ge,,,,,kqljBo
